,Comentarios,Idioma,TweetPre
4766,mariana gomez como luz arenas heno adolescencia verdadera inigualable unica maravillosa cantante musica popular arenas heno los ensayos producción arenas heno canto para llorar,es,mariana gomez arelys henao adolescencia verdadera inigualable unica maravillosa cantante musica popular arelys henao ensayos produccion arelys henao canto llorar
4767,pone poco nervioso que carlos sobra calle mientras hablan con loro secretada,es,pone nervioso carlos sobera calle mientras hablan loro secretgala
4770,tenes sueno estoy triste,es,tenes sueno triste
4771,acuerdan del episodio bob esponja donde pone jajaja llorar porque quiere ser adulto solamente quiere que abuelita haga galletas bueno asi siento,es,acuerdan episodio esponja pone jajaja llorar quiere adulto solamente quiere abuelita haga galletas bueno siento
4772,quiero curarme ansiedad,es,quiero curarme ansiedad
4778,cansada estoy las pinches nevadas casi mato otro dia manejando haaaaarta tiene,es,cansada pinch nevada casi mato manejando haaarta
4779,cansado ver lomotif cazado jajaja,es,cansado lomotif vazado jajaja
4782,ansiedad una foto,es,ansiedad foto
4783,realmente sabe como fue dinamica familiar ellos desde ninos como para hablar cain abel para hacer que hizo nino interior debio estar muy golpeado realmente muy triste,es,realmente sabe dinamica familiar ninos hablar cain abel hacer hizo nino interior debio golpeado realmente triste
4784,deja llorar raton,es,deja llorar raton
4786,sigo triste porque voy jajaja poder pero animo voy jajaja ver jajaja louis,es,sigo triste jajaja poder animo jajaja jajaja louis
4787,okey video pero intuyo que refieren jajaja una escena triste con bakugou entiendo porque pero digamos que tiene algo que ver una obey,es,okey video intuyo refieren jajaja escena triste bakugou entiendo digamos bnha obey
4788,con vos todo mas simple rato fue triste,es,simple rato triste
4789,necesito que este video deje aparecerme tengo los ojos hinchados tanto llorar cada vez que veo,es,necesito video deje aparecerme ojos hinchados llorar cada
4792,fue muy divertido beso maravilloso sonrie levanta brazo para ser ella quien acomoda cabello ajeno como hace esto primera vez que enamoro alguien tengo miedo hacer algo mal rie nerviosa,es,divertido beso maravilloso sonrie levanta brazo acomoda cabello ajeno hace primera enamoro alguien miedo hacer nerviosa
4793,estoy muy triste ver que dan jajaja hija comida escuela plato que los perros comen por dios hasta cuando porque esa comida jajaja familia con tantas proteinas asi usted alimenta jajaja sus hijos para dar eso nada listo,es,triste jajaja hija comida escuela plato perros comen dios comida jajaja familia tantas proteinas usted alimenta jajaja hijos listo
4795,jajaja gato solo gusta llorar con urgencia debe consentir menos horas dia porque luego quiere escapar casa como quien dice dan amor aqui consigo otro lado bay,es,jajaja gato solo gusta llorar urgencia debe consentir menos horas luego quiere escapar casa dice amor aqui consigo lado
4796,gracias por recomendación pero olvidaste decirme que iba jajaja llorar vida jajaja,es,gracias recomendacion olvidaste decirme jajaja llorar vida jajaja
4799,ambas empresas privadas dejen llorar fachos incurables,es,ambas empresas privadas dejen llorar fachos inculiables
4800,este clima bajo una depresion impresionante,es,clima bajo depresion impresionante
4801,ansioso pra waterpolo eyes amo lana amor,es,ansioso watercolor eye lana amor
4803,muy facil saber ese hombre esta triste solo dime que vinyl puso amy warehouse,es,facil saber hombre triste solo dime vinyl puso winehouse
4807,acabo ver una foto tipica chavala que esta buenisima sabe con top bertha que nunca puesto porque literalmente daria ataque ansiedad salir con puesto asco que doy momento querer arrancarse piel edad,es,acabo foto tipica chavala buenisima sabe bershka nunca puesto literalmente daria ataque ansiedad salir puesto asco momento querer arrancarse piel xdxd
4814,mikes ando bien preocupada por que aun tengo terrenito neta,es,amikes ando bien preocupada terrenito neta
4818,estaba por llorar con tweet arriba hasta que tuyo jaja,es,llorar tweet arriba jahsja
4819,estoy preparando fine line las veces que hiciste llorar ahora voy jajaja llorar vivo dios amo harry,es,preparando fine line veces hiciste llorar ahora jajaja llorar vivo dios harry
4822,los hombres tambien sufren depresion postparto,es,hombre tambien sufren depresion postparto
4823,que rio por llorar que desastre,es,llorar desastre
4828,arde tanto garganta que puse jajaja llorar nomi,es,arde garganta puse jajaja llorar nomi
4830,otro dia camine cuadras subida termine agotada tengo mes medio aprox para poner mis patitas forma para irme jajaja escalar montanas sur,es,camine cuadras subida termine agotada medio aprox poner patitas forma irme jajaja escalar montanitas
4832,voy jajaja dejar trabajo estoy muy nervioso,es,jajaja dejar trabajo nervioso
4833,peor que dio ataque ansiedad,es,peor ataque ansiedad
4835,ella una vez dijo quite ser porque estas depresivo estas conmigo meses despues deje porque estaba jajaja los caminos viiidaaa son como esperaabaaaa,es,dijo quite user depresivo conmigo me despues deje jajaja caminos viiidaaa esperaabaaa
4836,voy jajaja escuchar adore you vivo tengo ganas llorar,es,jajaja escuchar adore vivo ganas llorar
4838,largue jajaja llorar parada del bus porque pense que habia perdido pues llego volviendo jajaja llorar emoción jsjsjsksj pasaba,es,largue jajaja llorar parada pense habia perdido pues llego volviendo jajaja llorar emocion jsjsjsksj pasaba
4840,foto cuando tenias anos sin llorar puede realmente llorar era activa pesaba kilos unica responsabilidad era colegio,es,foto tenia ano llorar puede realmente llorar activa pesaba kilo unica responsabilidad colegio
4842,todo absolutamente todo sonrisa como canta como baila como expresa como piensa los demas haberes cuando estoy triste solo mirarlo puede hacer reir pongo feliz butter butter bus,es,absolutamente sonrisa canta baila expresa piensa demas habeses triste solo mirarlo puede hacer reir pongo feliz butter butter
4843,solo tengo ganas acurrucarme jajaja escuchar fine line llorar,es,solo ganas acurrucarme jajaja escuchar fine line llorar
4848,juro como hace para siempre hacernos llorar,es,juro hace siempre hacernos llorar
4851,hora mas triste del enero,es,hora triste enero
4853,cheques suspende pandemia hermano esta cansado,es,chiques suspende pandemia hernani cansado
4862,escuchando jajaja michelines dijo que con luc ahora policia hombre puede cachear jajaja una mujer leyes policiales sabe nada miente eso esta prohibido desde siempre pero sigue tirando mentiras desesperado este bueno para nada,es,escuchando jajaja micheline dijo ahora policia hombre puede cachear jajaja mujer leyes policiales sabe miente prohibido siempre sigue tirando mentiras desesperado bueno
4863,ansiedad pega mal,es,ansiedad pega
4864,viejo fue jajaja ver fue diciendole jajaja todo mundo que juego como meandro paredes hagas llorar poseo,es,viejo jajaja diciendole jajaja mundo juego leandro paredes hagas llorar posho
4866,lloro ocasiones estupidas cuando trata algo realmente triste tan solo quedo blanco raro,es,lloro ocasiones estupidas trata realmente triste solo quedo blanco raro
4867,que tengo depresion jajaajajajajsjsjs,es,depresion jajaajajajajsjsjs
4868,causa mucha ansiedad pensar como chingados voy jajaja comprar una casa,es,causa mucha ansiedad pensar chingados jajaja comprar casa
4873,lei muñequito porcelana aun quiero llorar,es,munequito porcelana quiero llorar
4875,casualidad que guacamayo ponga nerviosa con las que nominan jajaja alvaro hector alante tengo claro teamcarmen teamrafa teamalvaro teamalatzne secret secret secretada,es,casualidad guacamaya ponga nerviosa nominan jajaja alvaro hector alatzne claro teamcarmen teamrafa teamalvaro teamalatzne secret secret secretgala
4880,podria haberte pasado algo todavia mas triste pero elegi ser buena persona,es,podria haberte pasado todavia triste elegi buena persona
4882,quede dia con askmantikintikam siento que como siempre tan pesimas las conclusiones lots calla descubierta pasa nada vemos llorar pedir perdon luego salto temporal aca pasado nada empecemos nuevo penca considero serie terminada,es,quede askmantikintikam siento siempre pesimas conclusiones plot cagla descubierta pasa vemos llorar pedir perdon luego salto temporal pasado empecemos nuevo penca considero serie terminada
4885,salen puros videos harry vid quiero llorar hasta morirme,es,salen puros video harry quiero llorar morirme
4888,dibujo tecnico genera ansiedad mecagoentodo esto deberia pasar pero pasa mal joer,es,dibujo tecnico genus ansiedad mecagoentodo deberia pasar pasa joer
4892,jaksjaksjjs hasta crees semestre pasado hizo llorar asi espero pase eso otra vez,es,jaksjaksjjs cree semestre pasado hizo llorar espero pase
4893,eres rara andrea estoy preocupada cuidate mira amo,es,rara andrea preocupada cuidate mira
4897,pero con cabeza alta siempre que ahi parece todo muy triste tanto,es,cabeza alta siempre parece triste
4898,muy triste pero ahora tienes hacer uno para,es,triste ahora hacer
4899,mentira porque manana enterramos jajaja sobrino tambien por paro cardiaco despues verle puesto vacuna triste,es,mentira manana enterramos jajaja sobrino tambien paro cardiaco despues averle puesto vacuna triste
4904,ahi publicare dibujos mis ships otras que dieron ganas hacer arte casual habitual arte especial tendre candado hasta que algo grave pase simplemente ansiedad obligue jajaja hacerlo,es,publicare dibujos ship dieron ganas hacer arte casual habitual arte especial tendre candado grave pase simplemente ansiedad obligue jajaja hacerlo
4905,siento vacia ahora que hacer quizas termine ver inuyasha que deje abandonado quizas,es,siento vacia ahora hacer quizas termine inuyasha deje abandonado quizas
4908,mutis dicen que dibujo ferrys now pueda vender comisiones porque siempre esta meme ando medio desesperada sijs pero verdad que genera bastante publico,es,mutis dicen dibujo furrys nsfw pueda vender comisiones siempre meme ando medio desesperada jsjjs verdad genus bastante publico
4912,mis noches basan llorar beber dos litros agua mear como una puta desgraciada,es,noches basan llorar beber litros agua mear puta desgraciada
4915,voy jajaja llorar todo dia por haber conseguido entradas para harry,es,jajaja llorar haber conseguido entradas harry
4917,triste todas esas adicionales salario esos muchos otros cargos crean pretexto con eso funcionario cuestion libra vulnerabilidad jajaja corrupción gana suficiente caer esta aun asi son ellos mismos los promueven,es,triste toda adicionales salario cargo crean pretexto funcionario cuestion libra vulnerabilidad jajaja corrupcion gana suficiente caer mismos promueven
4919,tiembla todo cuerpo quiero hacerme bicho bolita tirarme llorar,es,tiembla cuerpo quiero hacerme bicho bolita tirarme llorar
4923,verdad los ojos villa tienden jajaja ser apagados tiene ojito mas cerrado que otro martin habia fijado sus pestañas pero irradia una mirada paz amor pana pero ultimamente veo jajaja isaca con una mirada cansada igual por cabello,es,verdad ojos villa tienden jajaja apagados ojito cerrado martin habia fijado pestanas irradia mirada amor pana ultimamente jajaja isaza mirada cansada igual cabello
4924,que triste realidad,es,triste realidad
4927,esta bien broma mercurio retrogrado verdad quiero llorar,es,bien broma mercurio retrogrado verdad quiero llorar
4928,deberias dormir mas noche comentaba poco triste,es,deberias dormir noche comentaba triste
4929,llevo dias ocupada con asuntos que son mios olvide cuidarme ahora estoy triste enferma sola,es,llevo dia ocupada asuntos mios olvide cuidarme ahora triste enferma sola
4930,estoy cansada todo todos,es,cansada
4931,algo cansado verdad pero nada ire jajaja dormir que hay que madrugar,es,cansado verdad jajaja dormir madrugar
4934,sera opinion impopular tal vez puedes dedicarte jajaja cuidar jajaja tus hijos querrias hacerlo mejor tengas hijos saltar entre vida profesional cuidado hijos tareas del hogar tramites tareas varias sentir que nada puedes hacer completo muy triste,es,serum opinion impopular puedes dedicarte jajaja cuidar jajaja hijos querrias hacerlo mejor hijos saltar vida profesional cuidado hijos tareas hogar tramites tareas varias sentir puedes hacer completo triste
4941,ahora que veo estoy profundamente feliz conmovido jajaja cada segundo agradecido compartir mundo quienes ven ansioso por conocerlo profundidad,es,ahora profundamente feliz conmovido jajaja cada segundo agradecido compartir mundo ansioso conocerlo profundidad
4942,estoy tan triste que esto hizo llorar nuevo,es,triste hizo llorar nuevo
4943,solo queria escuchar jajaja levi cantando termine triste,es,solo queria escuchar jajaja levi cantando termine triste
4944,como persona que tampoco gusta mayonesa sus tortas muy triste pero quisiera saber donde vendes quiero jajaja comprar nombre bici,es,persona tampoco gusta mayonesa tortas triste quisiera saber vendes quiero jajaja comprar nombre biuri
4949,que triste paz descansen,es,triste descansen
4951,muy triste demasiado fuerte nos sentimos bien donde estamos con quien estamos mejor alejemos lugares personas que nos den paz pero daremos esta vida menos nuestra eternidad,es,triste demasiado fuerte sentimos bien mejor alejemos lugares persona daremos vida menos eternidad
4954,quisiera xd dan mil ataques ansiedad,es,quisiera ataques ansiedad
4957,estoy triste,es,triste
4958,que horrible triste noticia pueblo sin ley donde vida vale nada gente basura desgraciados,es,horrible triste noticia pueblo vida vale gente basura desgraciados
4960,estoy muy pero que muy preocupado por prima riesgo,es,preocupado prima riesgo
4963,presidente comparando jajaja una con colegio militar preocupado por los millones que esta ganando presidente dedillo mientras tanto,es,presidente comparando jajaja unam colegio militar preocupado millones ganando presidente zedillo mientras
4965,mas triste que mayoria animes,es,triste mayoria anime
4967,mitsuko harry voy jajaja llorar quiero,es,mitski harry jajaja llorar quiero
4968,arden las piernas amigos sol quemo demasiado ahora arden las piernas las tengo rojas voy jajaja llorar,es,arden pietnas amigo quemo demasiado ahora arden piernas rojas jajaja llorar
4971,totalmente acuerdo mucho apoyo jajaja unico que ayudo jajaja salir depresion fue contarselo jajaja alguien confianza que sepa escuchar,es,totalmente acuerdo apoyo jajaja unico ayudo jajaja salir depresion contarselo jajaja alguien confianza sepa escuchar
4973,bueno voy yendo porq largo jajaja llorar cualquier momento nuevo por conseguir entradas,es,bueno yendo porq largo jajaja llorar cualquier momento nuevo conseguir entradas
4976,ahora voy jajaja llorar,es,ahora jajaja llorar
4977,creo que esta avellana podes jajaja llorar ahi cantarle hubieras ido seria tan feliz jajaja,es,creo avellaneda podes jajaja llorar cantarle seria feliz jajaja
4979,tres dias sin besar ser amado tres que triste,es,tres dia besar amado tres triste
4981,llorado por pensar demasiado tonterias llevaba sin llorar literalmente mas ano,es,llorado pensar demasiado tonterias llevaba llorar literalmente
4987,silva avaros don comedia rauda caso hace poco estaba triste afligido realmente estamos una dictadura hubieran desaparecido prometida estaria llorando pero ahi anda contento gordo,es,silva avalos comedia rauda caso hace triste afligido realmente dictadura desaparecido prometida estaria llorando anda contento gordo
4989,entendido pero que estoy cucu mio manita alto pollito trapo pero cucu ansiedad como para pararme jajaja argumentar menos mal que soy una pocos followers que paraque,es,entendido cucu manita alto pollito trapo cucu ansiedad pararme jajaja argumentar menos pocos follower parraque
4991,colores las emociones tristeza azul ingles solo basta una palabra nuestro pais una las bandas blues jajaja contra blues luego hay canciones como gato que esta triste azul roberto carlos,es,colores emociones tristeza azul ingles solo basta palabra pais bandas blue jajaja blue luego canciones gato triste azul roberto carlos
4992,esta escena que ayudo jajaja terminar sin llorar jajaja los gritos joda,es,escena ayudo jajaja terminar llorar jajaja gritos joda
4994,estaba tan nervioso esa parte dios igual llore,es,nervioso parte dios igual llore
4997,jajaja veces pienso que problema tengo que que tengo porque soy una adicta jajaja internet que impide ser productiva pero cuando hasta los profesores estan estados mal organizados digo que problema sistema bueno dejo llorar divagar sus,es,jajaja veces pienso problema adicta jajaja internet impide productiva profesores estan organizados digo problema sistema bueno dejo llorar divagar jsjs
5007,depresion,es,depresion
5010,jugar robo cuando estas triste,es,jugar roblox triste
5011,manana veo con ansiedad jajaja mil pagina teleticket,es,manana ansiedad jajaja pagina teleticket
5014,paso estar super feliz por que vere jajaja harry noviembre jajaja estar triste por que tengo boleto para louis,es,paso super feliz vere jajaja harry noviembre jajaja triste boleto louis
5015,joder ahogo poco igual tengo comida ansiedad,es,joder ahogo igual covid ansiedad
5016,que onda hizo llorar este video,es,onda hizo llorar video
5018,abandono mama eso dira jajaja sus alumnos mucho curriculum poca viveza pobre triste weon,es,abandono mama dira jajaja alumnos curriculum poca viveza pobre triste weon
5022,jajaja dormir temprano que estoy triste,es,jajaja dormir temprano triste
5035,dolar hoy jajaja pesos estaba jajaja pesos hace dos anos riesgo pais brillando los mil puntos sueldos hambre pobreza gobierno cientificos hizo silencio los llorones pantano hablamos solo este triste gobierno anos del kircherismo,es,dolar jajaja peso jajaja peso hace ano riesgo pais orillando puntos sueldos hambre pobreza gobierno cientificos hizo silencio llorones antano hablamos solo triste gobierno ano kircherismo
5036,tipico progres ahora tan chiquita sola por mundo triste,es,tipico progres ahora chiquita sola mundo triste
5037,color rojo mis ojos delata cansada que estoy,es,color rojo ojos delata cansada
5040,cada vez que miro videos carnavales anteriores genera nostalgia ansiedad mismo tiempo,es,cada miro video carnavales anteriores genus nostalgia ansiedad mismo tiempo
5042,siempre que uno los perritos hay drama todo equipo llorando algunas noches ansiedad sin dormir pero luego nos mandan fotos sus familias nos llenan felicidad ahi esta nuestro duque,es,siempre perritos drama equipo llorando noches ansiedad dormir luego mandan fotos familias llenan felicidad duque
5043,estoy nerviosa manana tatuó,es,nerviosa manana tatuo
5044,contestara historia pasa que ansiedad que genera pensar que podes clavarme visto quedar como una boluda deja,es,contestaria historia pasa ansiedad genus pensar podes clavarme visto quedar boluda deja
5046,qien llorar veremos jajaja lou jajaja harry,es,qien llorar veremos jajaja jajaja harry
5048,ganas llorar,es,ganas llorar
5050,todos tienen historias bien tragicas que queden chiquitos reconstruyendo sus vidas vivire muy triste,es,historias bien tragicas queden chiquitos reconstruyendo vidas vivire triste
5052,hace mucho sentia tan feliz nerviosa hablando con alguien,es,hace sentia feliz nerviosa hablando alguien
5053,chichi tengo problema haciendo caso gesto del joven tomaba asiento junto jajaja sofa nunca pense que ser actor trabajar jajaja vez fuera tan cansado,es,shichi problema haciendo caso gesto joven tomaba asiento junto jajaja sofa nunca pense actor trabajar jajaja cansado
5055,triste,es,triste
5058,quiero llorar con esos putos lugares,es,quiero llorar putos lugares
5061,podrian dejar presumir que sus papas les prestan atención que mio ansiedad,es,podrian dejar presumir papa prestan atencion ansiedad
5063,tambien como que ando ansiosa,es,tambien ando ansiosa
5064,que pasa estas triste tengo calor,es,pasa triste calor
5066,voy jajaja llorar,es,jajaja llorar
5074,como hacen para llorar con pestañas,es,hacen llorar pestanas
5077,ella esta preocupada justificar crecimiento por patrimonio anos tiene que seguir sisando,es,preocupada justificar crecimiento patrimonio ano seguir sisando
5081,voy jajaja llorar cris quiero mucho,es,jajaja llorar cris quiero
5082,dios pense que esa edad dormia corrido sofi hora que levanta por bibi hace semanas traia esa racha llorar noche como veces todos los dias,es,dios pense edad dormia corrido sofi hora levanta bibi hace semanas traia racha llorar noche veces dia
5085,las novelas coreanas son mejor para corazon triste aburrido strong woman recomendable para empezar,es,novelas coreanas mejor corazon triste aburrido strong woman recomendable empezar
5086,esperando jajaja que alguien venda entrada para madrid han agotado,es,esperando jajaja alguien venda entrada madrid agotado
5092,voy jajaja ser sincera entiendo objetivo del hate tirarle mierda jajaja una persona para hacerla sentir insignificante estar jugando con salud mental por que tan vacia vida tan miserable eres que quieres hacer sentir mal jajaja los demas hay cosas que entiendo,es,jajaja sincera entiendo objetivo hate tirarle mierda jajaja persona hacerla sentir insignificante jugando salud mental vacia vida miserable quieres hacer sentir jajaja demas cosas entiendo
5094,cansada ver jajaja cara moon nayoung notify yuju,es,cansada jajaja cara moon kayoung spotify yuju
5096,mental corporalmente cansada,es,mental corporalmente cansada
5101,puedo decir como siento que largo jajaja llorar,es,puedo decir siento largo jajaja llorar
5102,deja llorar jajaja pasar tranquilito,es,deja llorar jajaja pasar tranquilito
5106,estoy tan triste angel manos bloqueo por decirle caripelao,es,triste angel matos bloqueo decirle caripelao
5109,deseo todo corazon que logres recuperarte insomnio para que fortalezcas fisica mentalmente abrazo mis oraciones,es,deseo corazon logres recuperarte insomnio fortalezcas fisica mentalmente abrazo oraciones
5111,esto lit cantidad gente que ponia jajaja llorar hilos porque eren ablando ajshdjashj,es,cantidad gente ponia jajaja llorar hilo eren ablando ajshdjashj
5112,que estas triste,es,triste
5113,siempre que estoy triste quiero cortar pelo que bueno que hecho,es,siempre triste quiero cortar pelo bueno hecho
5117,hoy encontre con noviecita aunque fue corto poco triste adios casi todo salio bien aunque ella mas sanear jajaja los siempre dice que siente carino por felix saben que feliz siento lanista,es,encontre novicita aunque corto triste adios casi salio bien aunque stanear jajaja siempre dice carino felix saben feliz siento hanista
5118,que razon tan mala colombia esta cansada hambre falta empleo falta oportunidades que gradues con muchos prestamos deudas para final ganar minimo con descuentos por tener contrato eso que cansa lado eso politiquería canso,es,razon mala colombia cansada hambre falta empleo falta oportunidades gradues prestamos deudas final ganar minimo descuentos tener contrato cansa lado pilitiqueria canso
5122,voy jajaja llorar,es,jajaja llorar
5123,llego jajaja two solo para llorar,es,llego jajaja solo llorar
5125,que seria mis dias sin vladimir estaria sola casa pozo depresivo ahora estoy depresiva pero hace apoyo moral,es,seria dia bladimir estaria sola casa pozo depresivo ahora depresiva hace apoyo moral
5133,estoy triste traiganme chocolate aguila,es,triste traiganme chocolate aguila
5134,consegui entrada para harry quiero llorar,es,consegui entrada harry quiero llorar
5135,pongas triste hay otros tours nos vemos pronto desanimes estoy seguro que iras jajaja gira pronto estare esperando amo por necesitaban,es,pongas triste tour vemos pronto desanimes seguro ira jajaja gira pronto estare esperando necesitaban
5136,cuanto demoraran salir jajaja llorar los progres nunoinos por que dijo este valiente general,es,cuanto demoraran salir jajaja llorar progres nunoinos dijo valiente general
5138,cuando vacia frasco llevo vuelta,es,vacia frasco llevo vuelta
5142,pusieron jajaja cubrir puesto uno que fue vacaciones llevo dias estoy agotado como hubiese labrado todo mes,es,pusieron jajaja cubrir puesto vacaciones llevo dia agotado laburado
5146,con ultimo que escribiste solito respondes jajaja triste pero cierto,es,ultimo escribiste solit respondes jajaja triste cierto
5147,una capa invisible tiene poderes hace desaparecer llorar,es,capa invisible poderes hace desaparecer llorar
5154,hwa siento parecia ahora bastante angustiada por molestar jajaja aquella persona pero hablado con muchas personas enésima san nagi kun genocidio yo solo decia los nombres las personas que recordaba,es,uhwa siento parecia ahora bastante angustiada molestar jajaja aquella persona hablado muchas persona enoshima naegi genocider solo decia nombres persona recordaba
5157,estoy tan cansada todo,es,cansada
5158,vacio existencial que deja ver poco empática que gente,es,vacio existencial deja empatica gente
5162,chiringuitosimeone simone cansado por ganar sera mas que cansado esta acabado fin,es,chiringuitosimeone simeone cansado ganar serum cansado acabado
5165,puse triste solo jajaja ocurre escuchar love siento deje llevar amigos queria llorar esta noche,es,puse triste solo jajaja ocurre escuchar lodvg siento deje llevar amigo queria llorar noche
5169,que triste quererse chile vamos,es,triste quererse chile vamos
5170,mezcla sentimientos quiero quiero que sea manana estoy emocionada pero triste costara estar cerca jajaja,es,mezcla sentimientos quiero quiero manana emocionada triste costara cerca jajaja
5172,tanto iba jajaja buscar para tapar ese vacio ponia eso que estoy sola,es,jajaja buscar tapar vacio ponia sola
5173,existe algo peor que ataque ansiedad ataque ansiedad con asma,es,existe peor ataque ansiedad ataque ansiedad asma
