,Comentarios,Idioma,TweetPre
7195,otro mas jajaja llorar campito,es,jajaja llorar campito
7196,hago camino cansado polvoriento detenida dudosa queda tras juventud que baja hermosa cabeza niega jajaja acompanarme hermann jesse,es,hago camino cansado polvoriento detenida dudosa queda tras juventud baja hermosa cabeza niega jajaja acompanarme hermann hesse
7198,libro esta hoy agotado librerias ben,es,libro agotado llibreries
7199,cambiate empresa deja llorar,es,cambiate empresa deja llorar
7201,comprar top liga hacer llorar jajaja los pumas premio doble lira jajaja los anos jugo final semifinal tiene mucha experiencia esta liga,es,comprar liga hacer llorar jajaja puma premio doble lira jajaja ano jugo final semifinal mucha experiencia liga
7204,hoy siento triste tengo idea del porque,es,siento triste idea
7206,estoy tan cansada muchas cosas que cuento jajaja nadie,es,cansada muchas cosas cuento jajaja nadie
7210,veia tan nervioso jajaja grupo como los tibios hoy desde ultima fecha eliminatorias mundial avecina otra lloratontibia,es,veia nervioso jajaja grupo tibios ultima fecha eliminatorias mundial avecina lloratontibia
7211,uno los ataques ansiedad desprende poco una del menique tortura china,es,ataques ansiedad desprendi menique tortura china
7212,cansada que arden jajaja las candela,es,cansada bardeen jajaja candela
7220,bro lloraba ahora hasta una frase hace llorar,es,lloraba ahora frase hace llorar
7221,mira wey malo que estes triste llores hazlo cuando quieras recuerda que eresincreible tal como eres,es,mira malo estes triste llores hazlo quieras recuerda eresincreible
7224,estoy bien cuerpo ganas vomitar llorar por todo cae cabello,es,bien cuerpo ganas vomitar llorar cabello
7225,quedaban heladera fui bano solamente quedo este nose reir llorar todo recuerda jajaja,es,quedaban heladera bano solamente quedo nose reir llorar recuerda jajaja
7226,mereces flores mensajes bonitos que hagan llorar,es,mereces flores mensajes bonito hagan llorar
7228,ahi delante mente borrosa fuera por que grabamos partes del encuentro recordaria algunos momentos pero hizo conmigo que quizo final puso perrita vacio dentro amo sentir pene palpitante soltando lechita culito,es,delante mente borrosa grabamos partes encuentro recordaria momentos hizo conmigo quizo final puso perrita vacio dentro sentir pene palpitante soltando lechita culito
7229,parecemos generación cristal porque twitter dejo ser punto confrontación dialogo filosofia paso jajaja ser lugar donde todos todas ofenden por cualquier cosa tengamos mayor sintonia con debate dejemos llorar tanto dale cm,es,parecemos generacion cristal twitter dejo punto confrontacion dialogo filosofia paso jajaja lugar toda ofenden cualquier cosa mayor sintonia debate dejemos llorar dale
7233,jajaja ver mari gobierna ahora esta alberto decian que eran mejores gobiernen dejen llorar,es,jajaja mauri gobierna ahora alberto decian mejores gobiernen dejen llorar
7235,cuestion que entre habian agotado las del sector que queria siempre triunfando,es,cuestion habian agotado sector queria siempre triunfando
7236,hola ansiedad como por aqui nuevo,es,hola ansiedad aqui nuevo
7239,quieren dejar tal cual para que cambiarla somos sano ejemplo exportación que triste,es,quieren dejar cambiarla sano ejemplo exportacion triste
7240,parece desesperado,es,parece desesperado
7241,ansiedad eres una hija puta,es,ansiedad hija puta
7245,tiene cansada eso que hecho solo trabajooooo,es,cansada hecho solo trabajooo
7247,deja llorar juga,es,deja llorar juga
7248,muy triste ver como estan convirtiendo politica lodazal con los adversarios hay que debatir insultar forma que hacen algunos ustedes soez vulgar dice mucho quien por ese camino,es,triste estan convirtiendo politica lodazal adversarios debatir insultar forma hacen ustedes soez vulgar dice camino
7251,triste como gente sin vida propia pone jajaja buscar jajaja quien molestar fin mereces nada este hate eres una persona maravillosa,es,triste gente vida propia pone jajaja buscar jajaja molestar mereces hate persona maravillosa
7252,hay una mutual que queria nao creo que fue la triste,es,mutual queria creo triste
7253,primer opción dio indicios fracaso desde primer instante que hizo sentirse una encrucijada cual todos los caminos resultaban inciertos comenzo jajaja sentirse tanto nerviosa los primeros instantes incluso logro experimentar hormigueo,es,primer opcion indicios fracaso primer instante hizo sentirse encrucijada caminos resultaban inciertos comenzo jajaja sentirse nerviosa primeros instantes incluso logro experimentar hormigueo
7254,necesito llorar muchisimo,es,necesito llorar muchisimo
7255,ooooo quedate vayas mas tendre que llorar,es,ojooo quedate vayas tendre llorar
7256,vivir con ese vacio persona con que compartimos vivencias durante toda una vida algo que debemos llevar que nos quede vida hay otra llevaba anos sin escuchar palabra tirria decia abuelita materna,es,vivir vacio persona compartimos vivencias toda vida debemos llevar quede vida llevaba ano escuchar palabra tirria decia abuelita materna
7257,jajaja veces tengo ganas llorar ecuador ecuador para donde vamos,es,jajaja veces ganas llorar ecuador ecuador vamos
7259,estoy echando mucho menos ojala estes bien porque estoy algo preocupada,es,echando menos ojala estes bien preocupada
7260,estresa tener que esperar una encomienda soy demasiado ansiosa,es,estresa tener esperar encomienda demasiado ansiosa
7261,same duchado dios podido llorar tranquila,es,same duchado dios podido llorar tranquila
7269,prendere camara traducción estoy hinchada por llorar,es,prendere camara traduccion hinchada llorar
7270,voy jajaja culpar jajaja regla porque tengo muchas ganas llorar estoy muy triste que weaaaaaaaa,es,jajaja culpar jajaja regla muchas ganas llorar triste weaaa
7273,que estoy triste jajaja,es,triste jajaja
7274,voy jajaja enviar spam con corazones para que estes triste,es,jajaja enviar spam corazones estes triste
7275,cansada todo todos,es,cansada
7278,triste verdad asi mismo,es,triste verdad mismo
7280,cansado estoy mentalmente necesito irme vacaciones,es,cansado mentalmente necesito irme vacaciones
7281,acaban decir que tengo estilo buchón que triste deberas,es,acaban decir estilo buchon triste deberas
7288,ansiedad por mudarme mano,es,ansiedad mudarme mano
7291,ojala sea asi que vengan los inutiles del indy jajaja llorar despues,es,ojala vengan inutiles indh jajaja llorar despues
7292,mess hizo goles ano anda llorando voto maricones con los premios lean merecia ese pidio mess gala mess voto otro salga jajaja llorar gano disfrute listo cuando perdio salio todos lados,es,messi hizo goles anda llorando voto mariconea premios lewan merecia pidio messi gala messi voto salga jajaja llorar gano disfrute listo perdio salio lados
7293,llegue jajaja esa triste edad que preguntas jajaja tus amigos pueden tomar trago con medicamento que estan tomando,es,llegue jajaja triste edad preguntas jajaja amigo pueden tomar trago medicamento estan tomando
7299,deberia estar triste por eso una payasada manden fuerzas,es,deberia triste payasada manden fuerzas
7305,hola uso cap hace mas anos tengo apenas acostumbre puedo sin equipo una noche duermo sin cap levanto muy cansado,es,hola cpap hace ano apnea acostumbre puedo equipo noche duermo cpap levanto cansado
7307,esto solo inicio estoy cansada,es,solo inicio cansada
7308,que vacio inmenso enorme deja abuelo,es,vacio inmenso enorme deja abuelo
7310,cresca dedica jajaja llorar como sus fans tambien jajaja empujarla obvio,es,crpesca dedica jajaja llorar fan tambien jajaja empujarla obvio
7315,ayyyy viene explicación triste,es,ayyy viene explicacion triste
7316,dios llevo minutos despierta estoy con mucha ansiedad,es,dios llevo minutos despierta mucha ansiedad
7317,ansiedad que maneja novia por las pastas amo,es,ansiedad maneja novia pasta
7318,pero gobierno esta preocupado rematar casas gente que pidio bono las lucas,es,gobierno preocupado rematar casas gente pidio bono lucas
7319,procedo jajaja llorar,es,procedo jajaja llorar
7320,canción que hace llorar cada que escucho,es,cancion hace llorar cada escucho
7321,hoy algo cansada para entrenar pero que bien siente hacerlo,es,cansada entrenar bien hacerlo
7323,muchas gracias por stream hoy ansiedad jajaja tope pero primer dia completado estan gustando las carreras mario kar con huesitos plaquita espero puedas descansar bien capo km besito happy,es,muchas gracias stream ansiedad jajaja tope primer completado estan gustando carreras mario huesitos platiquita espero puedas descansar bien capo besito happy
7326,hna voy jajaja llorar,es,jajaja llorar
7327,recuperar motivación unica forma salir cualquier estado depresion por que puedas estar pasando,es,recuperar motivacion unica forma salir cualquier depresion puedas pasando
7328,que nervioso puso mercadolibre,es,nervioso puso mercadolibre
7331,pasa fuera joda voy jajaja llorar tras dias,es,pasa joda jajaja llorar tras dia
7333,lele mucho cabeza estoy cansada send nubes para darme mujercitas pedia,es,lele cabeza cansada send nude darme juercitas pedia
7336,vale ahora como paro llorar,es,vale ahora paro llorar
7337,hoy descargue bastante terapia llore bastante tambien odio llorar pero jajaja vez que necesito para limpiar corazon soy esto,es,descargue bastante terapia llore bastante tambien odio llorar jajaja necesito limpiar corazon
7339,soy persona mas desesperada caga gente impuntual aprendan jajaja respetar los pinches tiempos las personas malditasea,es,persona desesperada caga gente impuntual aprendan jajaja respetar pinch tiempos persona malditasea
7341,los cascos jajaja tope musica triste,es,cascos jajaja tope musica triste
7342,tiene que negar nada tampoco tiene que hablar sino quiere puede llorar sin ser juzgada parte del humano ser tan empático tranquila albino demuestra una sincera mueca preocupación luego estira hacia femina,es,negar tampoco hablar sino quiere puede llorar juzgada parte humano empatico tranquila albino demuestra sincera mueca preocupacion luego estira hacia femina
7343,ela triste feliz,es,triste feliz
7344,pop tengo ataque ansiedad medita cuenta hasta pop sin poder reaccionar logicamente hasta contar puedo pop dale gracias,es,ataque ansiedad medita cuenta poder reaccionar logicamente contar puedo dale gracias
7345,por eso este pokemon sensación ser mundo vacio poco llamativo explorar eso peor teniendo cuanta que vas hacer mayor parte del tiempo,es,pokemon sensacion mundo vacio llamativo explorar peor cuanta hacer mayor parte tiempo
7346,estado jajaja punto que diera ataque ansiedad trabajo,es,jajaja punto diera ataque ansiedad trabajo
7350,las ginko gatos deben ser destruidas derribadas hacen sentiran una notoria mejoria estado animo salud pensamientos insomnio ansiedad otros que aquejan tanto desvanecerá hasta ambiente dejara ser opresivo,es,zinko gatos deben destruidas derribadas hacen sentiran notoria mejoria animo salud pensamientos insomnio ansiedad aquejan desvanecera ambiente dejara opresivo
7351,porque vive con alguien muy preocupado porque solo municipio linus hay mas deserción escuelas secundarias porque situación desesperante sigo,es,vive alguien preocupado solo municipio lanus desercion escuelas secundarias situacion desesperante sigo
7354,conozco desconozco especificamente que sufres pero leo que postes agradezco por hacer visible depresion ansiedad que agobian causa molestia mando abrazo espero que todo pase,es,conozco desconozco especificamente sufres posteas agradezco hacer visible depresion ansiedad agobian causa molestia mando abrazo espero pase
7356,mis ganas llorar por enojo son pocas,es,ganas llorar enojo pocas
7358,abuela vio triste dio para que compre kilo helado mujer,es,abuela triste compre kilo helado mujer
7364,era depresion,es,depresion
7366,siento super cansada otro pedo,es,siento super cansada pedo
7368,cuando hagas algo noble hermoso nadie cuenta estes triste amanecer espectaculo hermoso sin embargo mayor parte audiencia duerme todavia john lennon,es,hagas noble hermoso nadie cuenta estes triste amanecer espectaculo hermoso embargo mayor parte audiencia duerme todavia john lennon
7371,que triste ver jajaja perrito envejecer,es,triste jajaja perrito envejecer
7375,miren que estaba loca por que arranque marginal pero que asco dos capitulos voy tengo ganas llorar vomitar traumada quede,es,miren loca arranque marginal asco capitulos ganas llorar vomitar traumadita quede
7376,este equipo esta roto simone dado todo que tenia que dar profe ortiga tambien decaido definitiva hay juego hay fisico entrenador para mas otra vez joke jugando los minutos felipe fin,es,equipo roto simeone dado tenia profe ortega tambien decaido definitiva juego fisico entrenador koke jugando minutos felipe
7377,para departamentos que recibe divisas mexicanas eso esta bien pero dejen llorar por tanto muerto eso trae ese negocio los pinten lideres sociales jajaja todos,es,departamentos recibe divisas mexicanas bien dejen llorar muerto trae negocio pinten lideres sociales jajaja
7381,hahahahhhsa que aqui esta pasando solo queria ver anime pandillas llorar,es,hahahahhhsa wakui pasando solo queria anime pandillas llorar
7383,estoy cansada mentalmente,es,cansada mentalmente
7384,metanse jajaja para conozca gente alguien diga feliz cumpleanos por favor estoy desesperada esto joda,es,metanme jajaja conozca gente alguien diga feliz cumpleanos favor desesperada joda
7385,cuando llegue jajaja valencia tenia miedo perder contacto con mis amigos aqui directamente saber mas ellos pues esta ocurriendo estoy poniendo nervioso muy nervioso llevo asi dias dias quiero separarme mis mejores amigos,es,llegue jajaja valencia tenia miedo perder contacto amigo aqui directamente saber pues ocurriendo poniendo nervioso nervioso llevo dia dia quiero separarme mejores amigo
7386,imbecil que genero toxicidad eres asi que deja llorar victimizar que hubieras subido nada habria muerto tema hasta illojuan mando jajaja casa,es,imbecil genero toxicidad deja llorar victimizarte subido habria muerto tema illojuan mando jajaja casa
7397,corta triste vida dina manchar nino salvaje que inspiro libro selva,es,corta triste vida dina sanichar nino salvaje inspiro libro selva
7402,nunca estuve tao triste por estar cerca,es,nunca estive triste certa
7409,preocupada por parecer disruptiva nuestra derecha latte mano solo consigue ser reaccionaria,es,preocupada parecer disruptiva derecha latte mano solo consigue reaccionaria
7411,estoy tan triste poder,es,triste poder
7414,puesto triste ver como tiraban nabos jarramplas pobrecillo,es,puesto triste tiraban nabos jarramplas pobrecillo
7417,invitan plena ola calor andaba desesperado pidiendo casa nadie dio bolilla,es,invitan plenum calor andaba desesperado pidiendo casa nadie bolilla
7419,asco aburrirme todos los dias estoy triste,es,asco aburrirme dia triste
7420,quitenme twitter cuando estoy triste porque expongo que pena,es,quitenme twitter triste expongo pena
7422,que ganas llorar todo dia que mierda tener tantos mambos con cuerpo,es,ganas llorar mierda tener tantos mambo cuerpo
7424,entro jajaja twitter dos segundos puse triste voy jajaja cantar sign the times vivo,es,entro jajaja twitter segundos puse triste jajaja cantar sign time vivo
7425,confusion por muerte del percusionista hector tito manos luego recibir triste noticia del fallecimiento del gestor cultural hector tito manos amistades conocidos del locutor que lleva mismo nombre apodo pensaron peor,es,confusion muerte percusionista hector tito matos luego recibir triste noticia fallecimiento gestor cultural hector tito matos amistades conocidos locutor lleva mismo nombre apodo pensaron peor
7426,quiero llorar pero nada mas acuerdo suelto jajaja llorar tengo sentimiento horrible,es,quiero llorar acuerdo suelto jajaja llorar sentimiento horrible
7427,estoy muy cansada jajaja,es,cansada jajaja
7429,triste pone tener ganas salir tener jajaja quien invitar,es,triste pone tener ganas salir tener jajaja invitar
7430,nuevocaminopokemon gusta mucho mundo abierto que tendra esperemos que este muy vacio,es,nuevocaminopokemon gusta mundo abierto tendra esperemos vacio
7432,con ansiedad jajaja mil encima tome mate,es,ansiedad jajaja encima tome mate
7433,estoy cansada,es,cansada
7434,destruye sonrisa jugkook mirar jajaja army encima ponen esta canción video peor mas extrano mas ganas llorar bus bus butter the summer antes,es,destruye sonrisa jugkook mirar jajaja army encima ponen cancion video peor extrano ganas llorar butter summer anthem
7435,hoy llega album echa acabo poner nerviosa,es,llega album enha acabo poner nerviosa
7437,encanta sonia pero alguien dijo eres vivo ejemplo del concepto depresion persona altiva que rectifica duena verdad quien siendo escritora escribe para exhibir aires superioridad darle jajaja palabra sentencia cosa juzgada,es,encanta sonia alguien dijo vivo ejemplo concepto depresion persona altiva rectifica duena verdad siendo escritora escribe exhibir aire superioridad darle jajaja palabra sentencia cosa juzgada
7439,tal vez tatuaje album bus quite triste,es,tatuaje album quite triste
7440,hermano esta burlando puse jajaja llorar por sink basta loco dejame paz,es,hermano burlando puse jajaja llorar basta loco dejame
7441,oigan voy concierto los mismas voy jajaja caer depresion por mil anos voy jajaja desaparecer redes advertidos,es,oigan concierto wiskas jajaja caer depresion ano jajaja desaparecer redes advertidos
7443,antes existiera mama tuvo gemelos pero lamentablemente murieron poco despues nacimiento resulta los genes tener gemelos mama los heredo jajaja ayer confirmaron voy jajaja ser papa bebes mas neta siento emocionado jajaja vez preocupado,es,existiera mama gemelos lamentablemente murieron despues nacimiento resulta gene tener gemelos mama heredo jajaja ayer confirmaron jajaja papa bebes neta siento emocionado jajaja preocupado
7445,twitter ver gente tuiteando cosas nazis humor negro super bestia decapitaciones amenazas muerte era normal ahora veo video perro cayendose pongo triste,es,twitter gente tuiteando cosas nazi humor negro super bestia decapitaciones amenazas muerte normal ahora video perro cayendose pongo triste
7446,buen juego pero ahi decir que tengo curiosidad por que jajaja venir recuerdo ningun personaje ninguna linea interesante ally ningun villano interesante una inteligencia artifical generica historia generica mundo vacio bonito generico,es,buen juego decir curiosidad jajaja venir recuerdo ningun personaje ninguna linea interesante aloy ningun villano interesante inteligencia artifical generica historia generica mundo vacio bonito generico
7452,atletico tiene que confiar mas mismo como equipo que son respecto banquillo que buscar una solución porque que jajaja cansado este club chiringuitocopa,es,atletico confiar mismo equipo respecto banquillo buscar solucion jajaja cansado club chiringuitocopa
7453,voy jajaja morir solo sin nadie que hablar simplemente solo solo solo una habitación vacia grande solo quiero saber nada mas,es,jajaja morir solo nadie hablar simplemente solo solo solo habitacion vacia grande solo quiero saber
7454,noooo donde saco plata jaajjjjajaakakak voy jajaja llorar,es,nooo saco plata jaajjjajaakakak jajaja llorar
7455,solo quiero llorar,es,solo quiero llorar
7461,stranger things otro lado comic querido llorar tanto con este comic quiero demasiado jajaja will ver que vivio otro lado rompe corazoncito aunque contesta jajaja varias las preguntas que hice viendo serie eso hace feliz,es,stranger thing lado comic querido llorar comic quiero demasiado jajaja will vivio lado rompe corazoncito aunque contesta jajaja varias preguntas hice viendo serie hace feliz
7463,cansada aparentar estar bien,es,cansada aparentar bien
7465,estoy pero bien cansado,es,bien cansado
7469,aun recuerdo contrasena voy jajaja llorar,es,recuerdo contrasena jajaja llorar
7472,yaaaa todos hablan tour callense ponen nerviosa,es,yaaa hablan tour callense ponen nerviosa
7480,hiciste llorar casi nunca llorar gracias por nada nada por todo,es,hiciste llorar casi nunca llorar gracias
7483,con ansiedad depresion mil mambos internos mas sigo pensando,es,ansiedad depresion mambo internos sigo pensando
7487,tantas veces buscamos algun lugar alguien calmar nuestra tristeza sentimos que nos desborda pecho lleno lagrimas corremos jajaja buscar refugio este poema que escribi hace mucho sobre aprender jajaja calmarme sola jajaja llorar sola jajaja ser que sostiene arrulla,es,tantas veces buscamos algun lugar alguien calmar tristeza sentimos desborda pecho lleno lagrimas corremos jajaja buscar refugio poema escribi hace aprender jajaja calmarme sola jajaja llorar sola jajaja sostiene arrulla
7488,soy tan cambiante tan ansiosa,es,cambiante ansiosa
7492,puso triste muerte,es,puso triste muerte
7493,mal momento para ataque ansiedad aksjsksh,es,momento ataque ansiedad aksjsksh
7497,verdad que asco gente que dedica jajaja llorar flamear una normal man llora cuando sea una ranger,es,verdad asco gente dedica jajaja llorar flamear normal llora ranked
7501,mama preocupada por short como explico,es,mama preocupada short explico
7502,deja llorar veni jajaja entrenar conmigo,es,deja llorar veni jajaja entrenar conmigo
7503,sabes que tiene nerviosa,es,sabes nerviosa
7504,estoy muy cansado pero que cosas buenas momento estres fuera dios,es,cansado cosas buenas momento estres dios
7509,dos semanas ataques ansiedad,es,semanas ataques ansiedad
7511,hoy largue jajaja llorar por dolor que siento todo cuerpo maldito comida,es,largue jajaja llorar dolor siento cuerpo maldito covid
7513,necesitas terapia pero urgente jajaja pobre vida tan miserable vacia tienes que entrar aqui jajaja desquitarte con gente jajaja pobrecita busca algo que hacer,es,necesitas terapia urgente jajaja pobre vida miserable vacia entrar aqui jajaja desquitarte gente jajaja pobrecita busca hacer
7514,nunca paso estar tan desesperada por jajaja costa siempre como siiii costa pero este ano estoy con una histeria estoy harta quiero ver playa quiero meterme mar seriooooo,es,nunca paso desesperada jajaja costa siempre siii costa histeria harta quiero playa quiero meterme seriooo
7515,gente que topa conmigo metro debe pensar esta leona puro que llora perdon senores pasajeros depresion tiene entera caca fuera por titi creo que podria salir cama,es,gente topa conmigo metro debe pensar weona puro llora perdon senor pasajeros depresion enterra caca titi creo podria salir cama
7517,hace bien llorar mando abrazos,es,hace bien llorar mando abrazos
7521,contra celta ultima batalla antes del paro vemos equipo agotado,es,celta ultima batalla paron vemos equipo agotado
7527,durante todo esto corazon latia jajaja mil por hora decia momento pasara eso destruiria segundo que paso empece jajaja llorar llanto ahogado unas lagrimas,es,corazon latia jajaja hora decia momento pasara destruiria segundo paso empece jajaja llorar llanto ahogado unas lagrimas
7528,entra depresion,es,entra depresion
7532,todo drama cara transmite mucha lastima impuesto bastante momento cuando recapacitado daba miedo como fuera juez pone preocupado jajaja cualquiera tremendo muy barbaro fuerte,es,drama cara transmite mucha lastima impuesto bastante momento recapacitado daba miedo juez pone preocupado jajaja cualquiera tremendo barbaro fuerte
7533,cual contrapropuesta profesor mediocre por que esta pegado todo dia pendiente que dice otro para decir cualquier cosa eso siempre tiene tiempo para defender jajaja gran amigo urbe tan patetico desesperado,es,contrapropuesta profesor mediocre pegado pendiente dice decir cualquier cosa siempre tiempo defender jajaja gran amigo uribe patetico desesperado
7535,estoy tan triste pero por menos levante cama bane,es,triste menos levante cama bane
7537,estoy tan cansada todo,es,cansada
7538,senora usted imagina herida que nos tocara sanar jajaja nosotros cuando quinteto sus lacayos salgan alcaldia que triste porque seran muchos anos algo que tenia bases reconstrucción del inder buen comienzo em las calles medellín lavar piso etc,es,senora usted imagina herida tocara sanar jajaja quintero lacayos salgan alcaldia triste seran ano tenia base reconstruccion inder buen comienzo calles medellin lavar piso
7541,quiero llorar muchisimo,es,quiero llorar muchisimo
7545,estaba viendo stream viejo agus largue jajaja llorar pie extrano loco puedo ser tan debil jajaja austin,es,viendo stream viejo agus largue jajaja llorar extrano loco puedo debil jajaja agustin
7548,tener ansiedad todo tiempo peor,es,tener ansiedad tiempo peor
7550,que ganas afecto fisico estado triste,es,ganas afecto fisico triste
7552,hiciste llorar pero alegro dia,es,hiciste llorar alegro
7554,que onda vecino amigo todo bien con depresion noviembre sin pero nos metas jajaja todos por ahi que toy con toma chupettteee,es,onda vecino amigo bien depresion noviembre metas jajaja toma chupettteee
7560,osea como elijo entre eight six keiretsu mugen train vivo pues votare con corazon que hizo llorar conjunto fue vivo florete eye song,es,osea elijo eighty kimetsu mugen train vivy pues votare corazon hizo llorar conjunto vivy fluorite song
7561,lamentable que tenga que llegar jajaja este punto muy triste que esta mujer que hecho mas que dar mejor por todo ano aguantando mierdas llegue jajaja sentir esto peor que tiene razon siento mucha rabia impotencia por sara merece este hate,es,lamentable llegar jajaja punto triste mujer hecho mejor aguantando mierdas llegue jajaja sentir peor razon siento mucha rabia impotencia sara merece hate
7563,todas esas preguntas estaba poniendo nervioso sabia que haria estaba bien pero dude hacerlo johnny escucha con atención que peter jajaja corresponder debes estar tranquilo muy bien porque,es,toda preguntas poniendo nervioso sabia haria bien dude hacerlo johnny escucha atencion peter jajaja corresponder debes tranquilo bien
7564,breve llorar por,es,breve llorar
7566,estas ganas llorar,es,ganas llorar
7575,ansiedad hacer cama voy vida chau,es,ansiedad hacer cama vida chau
