,Comentarios,Idioma,TweetPre
2412,que hace cuando estas feliz nada quieres llorar,es,hace feliz quieres llorar
2414,bien sel cansada del gimnasio jajaja vos,es,bienn cansada gimnasio jajaja
2415,vale llorar porque ceremonia guadalajara,es,vale llorar ceremonia guadalajara
2416,hecho darte cuenta que juego cuando freddy decia aqui hay conejo darte cuenta que referia jajaja vanny jajaja bonnie pone muy triste,es,hecho darte cuenta juego freddy decia aqui conejo darte cuenta referia jajaja vanny jajaja bonnie pone triste
2422,triste labor recibe abrazo sincero,es,triste labor recibe abrazo sincero
2426,solo quiero sentarme jajaja llorar amor por anos,es,solo quiero sentarme jajaja llorar amor ano
2429,estoy triste chau,es,triste chau
2431,serias pusiera nerviosa,es,serias pusiera nerviosa
2442,nooooo que dia tan triste,es,nooo triste
2443,llorar clase estadistica pasion,es,llorar clase estadistica pasion
2444,escuchando rap triste jajaja manana,es,escuchando triste jajaja manana
2446,hay concierto que esta respirando nunca estoy nerviosa,es,concierto respirando nunca nerviosa
2449,estoy tan cansada vos,es,cansada
2451,que triste celebrar logros ajenos man river compara jajaja barcelona ayer mas ellos nunca descendieron,es,triste celebrar logros ajenos river compara jajaja barcelona bayern nunca descendieron
2453,llorar por manes nah llorar por plata antojo,es,llorar mane llorar plata antojo
2455,que lastima con cambio dirigencia comienzan las cagadas river busca dinero extra sin mirar las consecuencias comienzan los festivales estadio tanto costo mejorar cancha ahora empezaran jajaja destrozar cesped todo muy triste,es,lastima cambio dirigencia comienzan cagadas river busca dinero extra mirar consecuencias comienzan festivales estadio costo mejorar cancha ahora empezaran jajaja destrozar cesped triste
2457,llorar imagen sus ojos reflejando miedo jajaja que hiciera dano hacia unos dias como habia temblado ante solo idea que hacia unos minutos hubiera alzado mano contra ella justo eso era que queria protegerla cuando volvio jajaja conocerla tras tantos,es,llorar imagen ojos reflejando miedo jajaja hiciera dano hacia dia habia temblado solo idea hacia minutos alzado mano justo queria protegerla volvio jajaja conocerla tras tantos
2458,esto muy triste,es,triste
2460,llorar hace bien alma,es,llorar hace bien alma
2465,muy triste que todavia haya mucha gente asi,es,triste todavia mucha gente
2466,que cansado ser adulto independiente,es,cansado adulto independiente
2470,pero hoy imagino cumple jope es que majo quiero monton voy jajaja llorar,es,iaguino cumple jope majo quiero monton jajaja llorar
2471,cansada vos,es,cansada
2472,ansiedad sunflower mercurio visible nina,es,ansiedad sunflower mercurio visible nina
2474,volvere jajaja ver jajaja bebe asi dios quiero irme jajaja casa llorar marees,es,volvere jajaja jajaja bebe dios quiero irme jajaja casa llorar mareees
2476,cansada,es,cansada
2477,las personas que salen jajaja bailar cuando pista esta vacia son las mas importantes del mundo,es,persona salen jajaja bailar pista vacia importantes mundo
2478,hace rato puse jajaja hacer tik tok estaba tan feliz que notaba pero luego hacerlos senti gran vacio dentro que cambio cara rapidamente,es,hace rato puse jajaja hacer feliz notaba luego hacerlos sent gran vacio dentro cambio cara rapidamente
2481,esta foto artemis por mucho que haga duro tienen mas fans llorar que cuando acabo libro,es,foto artemis haga duro fan llorar acabo libro
2482,depresion una mierda desgasta poco jajaja poco manera muy silenciosa,es,depresion mierda desgasta jajaja manera silenciosa
2483,ansiedad juntitas mano,es,ansiedad juntitas mano
2484,dolio tanto jajaja pone jajaja llorar habitación sin boleto para harry styles sin dinero,es,dolio jajaja pone jajaja llorar habitacion boleto harry style dinero
2490,dia sin paja logrado burlar mis propios planes sabotaje quedo una sensación vacio ahora veo todo manera distinta por que estamos aqui reproducirnos para preservar especie para que por jajaja por nos extinguiremos junto con tierra,es,paja logrado burlar propios plane sabotaje quedo sensacion vacio ahora manera distinta aqui reproducirnos preservar especie jajaja extinguiremos junto tierra
2491,tengo mija que jajaja llorar vas hacer vos pendeja fan kimura,es,mija jajaja llorar hacer pendeja kimburra
2494,que noticia tan triste mal recuerdo gaspar ellie solo visto paris aime reflejo sibel cada una tuvo interpretaciones discretas pero muy buenas duele que haya ido tan joven con una carrera tan prometedora por delante dep,es,noticia triste recuerdo gaspard ulliel solo visto paris aime reflejo sibyl cada interpretaciones discretas buenas duele joven carrera prometedora delante
2497,cachorro triste miserable podido,es,cachorro triste miseravel fodido
2498,que liado siento haberos preocupado haberlo liado tan parda,es,liado siento haberos preocupado haberlo liado parda
2499,disculpen que hay que les tuiteo mas que otros pero por mis estados depresion,es,disculpen tuiteo depresion
2502,sabes predilección por los loboutin los terceros combinados con vestido cuarto medias negras tal insomnio,es,sabes predileccion loboutin terceros combinados vestido cuarto medias negras insomnio
2507,termine reina del flow siento vacia con que voy jajaja vaciar ahora,es,termine reina flow siento vacia jajaja viciar ahora
2509,perdi muchos puntos con ari sirvo para las apuestas estoy triste,es,perdi puntos sirvo apuestas edtoy triste
2510,quiero llorar por dias seguidos,es,quiero llorar dia seguidos
2513,odio sentirme agotada quiero estar acostumbrada dijo mioooo,es,odio sentirme agotada quiero acostumbrada dioj miooo
2514,cuando simio vio que seguia puso jajaja llorar jajaja,es,simio seguia puso jajaja llorar jajaja
2515,ahora entero que publicar noticias llorar senor vayase poco jajaja tomar viento quiere,es,ahora entero publicar noticias llorar senor vayase jajaja tomar viento quiere
2519,ver jajaja guacamayo nerviosa esta poniendo mal secretada,es,jajaja guacamaya nerviosa poniendo secretgala
2522,senor mando snacks para sobrevivir convicto mama anda comiendo estado triste,es,senor mando snack sobrevivir covicho mama anda comiendo triste
2526,asi tenemos mucho ninos mexico triste frustrante por menos cada familia mexicana conocemos caso cercano con comida exigimosvacunasparaninosyadolecentes,es,ninos mexico triste frustrante menos cada familia mexicana conocemos caso cercano covid exigimosvacunasparaninosyadolecentes
2527,escucho gritar llorar jajaja habitación lado era ayer les juro,es,escucho gritar llorar jajaja habitacion lado ayer juro
2529,cansada que siempre sea mismo,es,cansada siempre mismo
2531,fhsamerican bon cuando esta asustado tiene ansiedad dan ganas llorar empieza jajaja sudar como tuviera demasiado calor empieza jajaja doler cabeza causando que tenga transformaciones extranas aleatorias demonio monstruos etc,es,fhsamerican asustado ansiedad ganas llorar empieza jajaja sudar demasiado calor empieza jajaja doler cabeza causando transformaciones extranas aleatorias demonio monstruos
2534,por que humanizan personaje detestable voy jajaja llorar peacemaker neelix pacificador,es,humanizan personaje detestable jajaja llorar peacemaker netflix elpacificador
2536,papa hizo llorar real que amo jajaja mis progenitores con todas mis fuerzas,es,papa hizo llorar real jajaja progenitores toda fuerzas
2541,doctor mau despues dias sigue dando positiva prueba antígenos normal gracias esposo esta desesperado,es,doctor despues dia sigue dando positiva prueba antigenos normal gracias esposo desesperado
2545,ayer cuando trate entrar jajaja entrevista por instagram con maura recomienda libro tuve momento panico podia hacerlo habia muchas personas salon virtual esperandonos picando teclas aqui alla desesperada,es,ayer trate entrar jajaja entrevista instagram maura recomienda libro momento panico podium hacerlo habia muchas persona salon virtual esperandonos picando teclas aqui alla desesperada
2547,tiene cansada diga tantas cosas bonitas niego aceptar gusta varon hans poder mas normal,es,cansada diga tantas cosas bonitas niego aceptar gusta varon hanse kpoper normal
2548,ministro nación tiene que ver triste realidad los buenos despojados sus viviendas lleno carencias gracias jajaja esta mujer que defiende pregunto igual jajaja ella corruptos delincuentes,es,ministro nacion triste realidad jujenos despojados viviendas lleno carencias gracias jajaja mujer defiende pregunto igual jajaja corruptos delincuentes
2550,momento triste anime queria abrir mis joy con para arreglarles drift pero barrio tornillo cada uno puta madre nintendo,es,momento triste anime queria abrir arreglarles drift barrio tornillo cada puta madre nintendo
2551,una hamburguesa burger king haria que quite triste,es,hamburguesa burger king haria quite triste
2553,acabo enterar que una persona piensa que estoy mal cabeza vale aclarar que culpa por confirmar pensar que hay gente buena aun creo que todas las personas deprimen llevan anos con pareja terminan pase por una depresion,es,acabo enterar persona piensa cabeza vale aclarar culpa confirmar pensar gente buena creo toda persona deprimen llevan ano pareja terminan pase depresion
2560,pone super triste saber que joe hisaishi dara conciertos usa canada tengo,es,pone super triste saber hisaishi dara conciertos canada
2561,que esta pudiendo involucrarse cientos causas benéficas aportar verdad algo positivo jajaja sociedad desde estatus poder que fama dinero les dado unico que hacen llorar flipante macho por cierto auronplay otro puto gilipollas,es,pudiendo involucrarse cientos causa beneficas aportar verdad positivo jajaja sociedad estatus poder fama dinero dado unico hacen llorar flipante macho cierto auronplay puto gilipollas
2562,angustiada que estoy,es,angustiada
2564,mamada cristina merece mamaaaaaa hijo pero deja llorar mamaaaaaaaaaa dios mio eres tan injusto conmigo bueno hijo comportate como hombrecito volador seca sus lagrimas abrocha falta pone firme como una persona respetable,es,mamaaa cristina merece mamaaa hijo deja llorar mamaaa dios injusto conmigo bueno hijo comportate hombrecito folagor seca lagrimas abrocha falta pone firme persona respetable
2567,fueron jajaja llorar jajaja paraguay viva joda,es,jajaja llorar jajaja paraguay viva joda
2568,pues estar muy triste verte adorando jajaja infeliz asi simple enero ene,es,pues triste verte adorando jajaja infeliz simple enero
2576,pero fin ansiedad aceptación cuerpo viene cuando mas necesitas que vaya lejos asi vida asi somos nosotros,es,ansiedad aceptacion cuerpo viene necesitas vaya lejos vida
2578,amigo puede ser mas triste los dias nublados por tarde,es,amigo puede triste dia nublados tarde
2582,este momento bien creo pero fisicamente algo cansada anemia moment gracias por pregunta,es,momento bien creo fisicamente cansada anemia moment gracias pregunta
2583,que necesito una rumba bien apta para olvidar esta depresion,es,necesito rumba bien hpta olvidar depresion
2584,estan volviendo jajaja dar ataques ansiedad porque,es,estan volviendo jajaja ataques ansiedad
2589,jamas den jajaja una persona que esta pasando una crisis ansiedad compania gran valor para persona que los busca animo delincuencia,es,jamas jajaja persona pasando crisis ansiedad compania gran valor persona busca animo delincuencia
2592,muito triste pegar naranja seca,es,muito triste pegar laranja seca
2593,esto realmente pone muy triste,es,realmente pone triste
2594,ilegales hicieron llorar jajaja numusama ahora esto personal,es,ilegales hicieron llorar jajaja numusama ahora personal
2597,hacia mil anos que entraba cafe del sanborn recien egresada licenciatura ibamos jajaja llevar curriculum con una amiga jajaja las escuelas despues nos ibamos por cafe ilimitado besito llorar por nuestro desempleo,es,hacia ano entraba cafe sanborns recien egresada licenciatura ibamos jajaja llevar curriculum amiga jajaja escuelas despues ibamos cafe ilimitado pesito llorar desempleo
2602,que impotencia cuando roban que ganas llorar dios que sale,es,impotencia roban ganas llorar dios sale
2603,dios estoy muy nervioso solo panza vueltas,es,dios nervioso solo panza vueltas
2606,bueno hubieras preocupado por familia primer lugar habrias hecho cosas que alejara nosotros,es,bueno preocupado familia primer lugar habrias hecho cosas alejara
2611,esto verdaderamente frustrante agotador solo quiero sentarme jajaja llorar,es,verdaderamente frustrante agotador solo quiero sentarme jajaja llorar
2612,triste mundo una incomprendida,es,triste mundo incomprendida
2615,triste triste saber que juanito nunca jajaja terminar una aun asi tener,es,triste triste saber juanito nunca jajaja terminar fnaf tener
2622,puedo estar tan agotada mentalmente,es,puedo agotada mentalmente
2631,todos necesitamos yoon nuestra triste vida,es,necesitamos yoongi triste vida
2632,escondo algunos momentos insomnio sueno ligerísima casi recuerdo con nostalgia bien que dormi cuando tuve comida,es,escondo momentos insomnio sueno ligerisimo casi recuerdo nostalgia bien dormi covid
2633,lei varias veces queja debe fallar lento comprension porque encuentro sentido estoy perpleja millonarios checos odio agotada,es,varias veces queja debe fallar lecto comprension encuentro perpleja millonarios chetos odio agotada
2635,mejor podrias estar espero que virus afecte que pronto puedas volver jajaja los encuentros soy nuevo por aca pero estoy ansioso conocerlos,es,mejor podrias espero virus afecte pronto puedas volver jajaja encuentros nuevo ansioso conocerlos
2637,quiero dormir cansado,es,quiero dormir cansado
2639,ellos detendran sin importar cuanto los ignoremos hay limite ellos estan sobrepasando realmente muy cansado hemos intentado todo para evitar problemas estar paz pero ellos nunca han detenido deberian enfocarse fav pero una lastima,es,detendran importar cuanto ignoremos limite estan sobrepasando realmente cansado intentado evitar problemas nunca detenido deberian enfocarse lastima
2640,ansiedad consume hermano,es,ansiedad consume hermano
2641,quiero llorar,es,quiero llorar
2643,iba jajaja comer mis vitaminas acorde ayer momento ansiedad las comi todas una jejeje bueno,es,jajaja comer vitaminas acorde ayer momento ansiedad comi toda jajeje buenp
2648,manana estar esperando ansioso jajaja con esta convocatoria,es,manana esperando ansioso jajaja convocatoria
2652,los beneficios que puede ofrecer aromaterapia para ayudar jajaja controlar ansiedad,es,beneficios puede ofrecer aromaterapia ayudar jajaja controlar ansiedad
2653,cuate problema ellos juegan tecnico les convocan problema los romero deja llorar querer vos decidir que hacen otras personas vida mejor atender tuya esta cada loco opinando mamita,es,cuate problema juegan tecnico convocan problema romeros deja llorar querer decidir hacen persona vida mejor atende cada loco opinando mamita
2656,para llorar queda energia jsjsjsjs pm quiero vuelta vida mantenida,es,llorar queda energia jsjsjsjs quiero vuelta vida mantenida
2658,bebe llevamos anos meses lactancia jajaja veces siento que eso esta llegando jajaja fin pone feliz porque ser chupon cansado pero tambien pone triste nostalgica porque lactar una conexion muy especial que puede sentir otra manera,es,bebe llevamos ano me lactancia jajaja veces siento llegando jajaja pone feliz chupon cansado tambien pone triste nostalgica lactar conexion especial puede sentir manera
2659,vas cielo eso significa que estaras muerto sabes estoy preocupado por,es,cielo significa estaras muerto sabes preocupado
2660,mas triste que sus compinches malacate vendedores los defienden atacan verbalmente jajaja los policias cuando ellos son los agredidos planta mareos tienen,es,triste compinches malacates vendedores defienden atacan verbalmente jajaja policias agredidos planta mareros
2662,hoy esos dias realidad son varios que siento bajon aburrida triste sola desganada como que hay nada que anime motive bajon,es,dia realidad varios siento bajon aburrida triste sola desganada anime motive bajon
2663,veamos esta triste historia,es,veamos triste historia
2665,muy triste dios bendiga jajaja familia jajaja esa bebita que perdio jajaja mama,es,triste dios bendiga jajaja familia jajaja bebita perdio jajaja mama
2670,con triste que puse hoy cuenta quien fav,es,triste puse cuenta
2674,volvio mood llorar por nada,es,volvio mood llorar
2678,sabes que mas triste que mucho carino jajaja tia veo que anabel esta salvame otra vez casualidad interes morbo flaco favor esta haciendo buenas noches brujita yomerebelo,es,sabes triste carino jajaja anabel salvame casualidad interes morbo flaco favor haciendo buenas noches brujita yomerebelo
2679,vacio que estoy sintiendo estos dias horrible,es,vacio dia horrible
2682,hoy cai jajaja triste realidad que soy,es,jajaja triste realidad
2683,tengo ganas llorar,es,ganas llorar
2687,para que naci para salvarme que tengo morir infalible dejar ver jajaja dios condenarme triste cosa sera pero posible,es,naci salvarme morir infalible dejar jajaja dios condenarme triste cosa serum posible
2689,espero que ese hombre sufra depresion porque cachetazo metafórico fue tremendo,es,espero hombre sufra depresion cachetazo metaforico tremendo
2692,estoy muy cansada siempre mismo,es,cansada siempre mismo
2693,monseeee tocado despedirme mis refuerzos una mezcla sentimientos que bueeeno luego son bien bonitos jajaja llorar,es,monseee tocado despedirme refuerzos mezcla sentimientos bueeeno luego bien bonito jajaja llorar
2695,acuerdo que estaba mal emocionalmente justo iba jajaja juntar com huelen brian cuando llegue jajaja casa brian entro jajaja habitación solo fueron segundos que celular largue jajaja llorar pero ellos siempre levantandome animo con champagne que amigo hace eso,es,acuerdo emocionalmente justo jajaja juntar huilen brian llegue jajaja casa brian entro jajaja habitacion solo segundos celular largue jajaja llorar siempre levantandome animo champagne amigo hace
2699,todas andamos haciendo muchas pero muchas teorias que mas gana ansiedad por llegue estreno,es,toda andamos haciendo muchas muchas teorias gana ansiedad llegue estreno
2701,pero cuando estoy triste nadie banca asi jsksjska,es,triste nadie banca jsksjska
2705,quiero tener tranquilidad estoy agotada tanta mierda,es,quiero tener tranquilidad agotada tanta mierda
2707,primer dia despues del convicto que acabo todas mis clases siento cansada dios fiel,es,primer despues covicho acabo toda clases siento cansada dios fiel
2709,igual por los fallos era antes que habia que llorar cagaron definitiva,es,igual fallos habia llorar cagaron definitiva
2711,son todos iguales misma linea pensamiento eso triste pero nada jajaja cambiar,es,iguales misma linea pensamiento triste jajaja cambiar
2712,entro jajaja agencia eliminan lista jajaja tsr mas salada chico que atendio notaba cansado pero atendio muy bien,es,entro jajaja agencia eliminan lista jajaja tsmr salada chico atendio notaba cansado atendio bien
2715,argentina tenemos solo una fecha agotada pesadas,es,argentina solo fecha agotada pesadas
2720,cosas mafia desesperada,es,cosas mafia desesperada
2722,empece jajaja tener todos los sintomas hipo entre una depresion mayor todos los dias lloraba por hecho estar enferma poder controlarlo sobre todo peso con todo esto pues termino problemas alimenticios body dismorphya,es,empece jajaja tener sintomas hipo depresion mayor dia lloraba hecho enferma poder controlarlo peso pues termino problemas alimenticios body dismorphya
2724,dice emilio que queres llorar llora,es,dice emilio queres llorar llora
2725,pues solo escuche jajaja una mujer pedir amablemente que dejaran las entrevistas para otro momento rodriguez por parte aclara que esta cansado que despues hablamos fin seguro robert fisk jon lee anderson sufrieron igual como reporteros guerra medio oriente,es,pues solo escuche jajaja mujer pedir amablemente dejaran entrevistas momento rodriguez parte aclara cansado despues hablamos seguro robert fisk anderson sufrieron igual reporteros guerra medio oriente
2733,por dios digas eso que voy jajaja llorar toda noche,es,dios digas jajaja llorar toda noche
2737,maddie buck juntos nuevo quiero llorar,es,maddie buck junto nuevo quiero llorar
2740,tan triste que esta chica llame asi misma pesada por hablar tema que deberia jajaja ser noticia todos los dias reina sigue asi dando voz jajaja los que pueden,es,triste chica llame misma pesada hablar tema deberia jajaja noticia dia reina sigue dando jajaja pueden
2741,porq llorar por algo nunca paso cuando puedo llorar por temporada tampoco paso,es,porq llorar nunca paso puedo llorar temporada tampoco paso
2742,tiemblo ansiedad del frio,es,tiemblo ansiedad frio
2743,hoy tengo una sorpresa jajaja esposo estoy reese nerviosa como cuando empezabamos jajaja ser novios anos atras,es,sorpresa jajaja esposo reee nerviosa empezabamos jajaja novios ano atras
2744,fua que mina ansiosa que soy,es,mina ansiosa
2745,tampoco nos largamos jajaja llorar,es,tampoco largamos jajaja llorar
2749,todoesverdad gente desesperada acude sin garantias jajaja los videntes,es,todoesverdad gente desesperada acude garantias jajaja videntes
2750,encima puedo llorar piercing loco,es,encima puedo llorar pierce loco
2751,ayer azul hablo los haters hoy andrea hablando del racismo que triste pero tanto les gustan hacer dano jajaja gente,es,ayer azul hablo hater andrea hablando racismo triste gustan hacer dano jajaja gente
2757,paso jajaja mis anos fanatica mal cierta actriz detenida cantante vino jajaja cordoma justo dia cumpleanos con complicidad familiar logre conocerla sacarme fotos con ella una pelea con hermana hip abrio camara velo rollo que manera llorar,es,paso jajaja ano fanatica cierta actriz devenida cantante vino jajaja cordoba justo cumpleanos complicidad familiar logre conocerla sacarme fotos pelea hermana abrio camara velo rollo manera llorar
2761,que voy jajaja llorar con bonito que haces todo,es,jajaja llorar bonito haces
2764,preguntas psicologicas haran voy jajaja poner jajaja llorar mitad del test odio vida,es,preguntas psicologicas haran jajaja poner jajaja llorar mitad test odio vida
2766,igual sigo triste por foto han puedo como unos chiquito tiento aguanto nla guapo,es,igualf sigo triste fotl puedo chiquto tiento aguabto guabgo
2767,odio comida sos unica cosa que puede poner triste,es,odio covid unica cosa puede poner triste
2768,verga esta cabron este vato como chicle mas pisan mas pega que triste,es,verga cabron vato chicle pisan pega triste
2769,estaba cuarto escuchando musica triste mama llego nada pregunto tenia novio habia dejado bye,es,cuarto escuchando musica triste mama llego pregunto tenia novio habia dejado
2770,maraton series dormir llorar antes dormir,es,maraton series dormir llorar dormir
2771,eso estar triste poner promise atroz sabiendo que nadie mas jajaja parte ellos dicen todo eso doy cuenta que fuerza fisica mental depende atroz atroz,es,triste poner promise ateez sabiendo nadie jajaja parte dicen cuenta fuerza fisica mental depende ateez ateez
2775,quiero dejar llorar rato pm,es,quiero dejar llorar rato
2776,pues que voto mas triste inconsciente miguel angel,es,pues voto triste inconsciente miguel angel
2779,dios todo dia depresiva pasaa,es,dios depresiva pasaa
2781,necesito urgentemente hacer llamada con ivan siento voy jajaja poner jajaja llorar nada,es,necesito urgentemente hacer llamada ivan siento jajaja poner jajaja llorar
2784,estaba hecho estoy nisiquiera estoy enojada dios quiero llorar,es,hecho nisiquiera enojada dios quiero llorar
2785,parte alma escuchar jajaja wendy llorar,es,parte alma escuchar jajaja wendy llorar
2788,que basura que horror sabia que salio corriendo jajaja sacar guita las cuentas bancarias pero del vacio espeluznante,es,basura horror sabia salio corriendo jajaja sacar guita cuentas bancarias vacio espeluznante
2792,adios quiero llorar,es,adiof quierp llorar
2793,solución para depresion cocacola,es,solucion depresion cocacola
2798,fondo craneo vacio queda grupito neuronas con que escribiste twist date por satisfecha,es,fondo craneo vacio queda grupito neuronas escribiste twitt date satisfecha
2801,estos fangos siempre voy jajaja burlarme como que son unos payasos siempre ponen jajaja llorar cuando antiguo exclusivo llega jajaja otras plataformas estos tipos mejor disfrutar cagarse risa ahora ponen jajaja llorar por decisiones corporativas,es,fanboys siempre jajaja burlarme payasos siempre ponen jajaja llorar antiguo exclusivo llega jajaja plataformas tipos mejor disfrutar cagarse risa ahora ponen jajaja llorar decisiones corporativas
2802,parado llorar aaaaaaaaaaaaaahhhhhhhh,es,parado llorar aaahhh
2804,pues tengo salud procede jajaja llorar,es,pues salud procede jajaja llorar
2806,mas triste que las estructuras nuestro pais estan descuido total calles mal estado salud para que contar educación por los suelos donde estan esos millones,es,triste estructuras pais estan descuido total calles salud contar educacion suelos estan millones
2807,comienza depresion semana previa cumpleanito,es,comienza depresion semana previa cumpleanito
2809,hace frio por que jajaja diosito vacio cloruro etilo cloroetano,es,hace frio jajaja diosito vacio cloruro etilo cloroetano
2810,esta matando puta ansiedad,es,matando puta ansiedad
2812,peor comer solo aislado mis viejos que hacia ano que veia comida del orto estoy tan podrido del barbijo saco para nada casi meto bocado jajaja comida con barbijo puesto estoy humor mierda triste aburrido eso solo dia,es,peor comer solo aislado viejos hacia veia covid orto podrido barbijo saco casi meto bocado jajaja comida barbijo puesto humor mierda triste aburrido solo
2814,hna estaba triste vieja compro alcohol asi nos criaron jajaja las,es,triste vieja compro alcohol criaron jajaja
2816,manana seguramente sale sky taller arabia dubai estoy lista para llorar,es,manana seguramente sale talker arabia dubai lista llorar
